cluster,titulo
11,Quantas perícias médicas o INSS precisa pagar?
11,Quem ganha mais de um salário mínimo no INSS recebe o 13º salário
11,Entenda as atuais regras do INSS para aposentadorias
11,Confirmado pagamento do 14º salário do INSS em 2022?
11,Auxílio Brasil: parcela de maio começa a ser paga na quarta; veja quem recebe
11,INSS: 13 dúvidas sobre o benefício Salário-Maternidade
11,Quem pode solicitar o BPC ao INSS?
11,Auxílio-Acidente do INSS pode liberar até quanto aos profissionais?
11,INSS: fila com mais de 1 milhão esperando por perícias
11,Programa do Auxílio Brasil: Como consultar o próximo pagamento?
11,INSS: Tem como reverter pedido negado?
11,Auxílio Brasil de maio: Veja quando será beneficiado
11,Governo autoriza novo saque do FGTS: Veja como ser beneficiado
11,INSS: regras de transição para aposentadoria especial
11,INSS: quem deverá pagar as perícias médicas?
11,Pagamento do BPC: Como ter liberação pelo INSS?
11,Aposentadorias do INSS com acréscimos
11,Quem pode receber pelo INSS o Auxílio-doença?
11,Solicitação da Aposentadoria por idade do INSS com novos requisitos
11,Autônomos: Confira como se inscrever para pagar o INSS
11,Posso fazer contas para liberação da aposentadoria especial do INSS?
11,Novo valor do Teto no INSS aos profissionais
11,Saque de R$ 1 mil do FGTS será liberado para nascidos em abril e maio nesta semana
11,13º do INSS: segunda parcela será paga a partir da próxima semana; veja calendário
11,Pagamento do BPC loas pode ser trocado pelo INSS?
11,Trabalhadores nascidos em maio podem sacar até R$ 1 mil no FGTS
11,Posso evitar os erros nos pedidos do INSS?
11,Nascidos em maio podem sacar até R$ 1.000 a partir de amanhã no FGTS
11,Extra de FGTS: Trabalhadores nascidos em abril recebem em novo lote
11,Onde é depositado o valor do Abono salarial do Pasep aos profissionais?
11,INSS: o que pode cancelar o seu benefício? Esteja atento
11,INSS: Dúvidas de quem vai dar entrada no Auxílio Doença
11,INSS pode libera aposentadoria para quem tem 55 anos de idade?
11,Posso ter aposentadoria vantajosa pelo INSS?
11,FGTS: saiba quem poderá fazer saque extraordinário de até R$ 1.000 esta semana
11,Saiba quando apresentar o CNIS para pedir benefícios ao INSS
11,Saque-Aniversário FGTS: liberado o saque para os nascidos em maio
11,"Saque do FGTS: 3,6 milhões de trabalhadores nascidos em junho poderão sacar até R$ 1 mil"
11,Aposentadoria e pensão informam novas regras no INSS
11,Entenda quem tem direito de ganhar como se fosse uma aposentadoria todos os meses no INSS
11,"INSS: Segunda parcela do 13º salário será liberada no fim de maio, veja como consultar"
11,Motivos que levam o INSS a suspender seu pagamento mensal
11,Auxílio-doença do INSS: Todo segurado pode ser beneficiado?
11,INSS: Veja as regras para se aposentar em 2022. Saiba o que mudou
11,Dúvidas no INSS sobre aposentadoria e regras
11,Veja como pedir a aposentadoria por invalidez 100% integral no INSS em 2022
11,Saque extraordinário do FGTS: quem não fez o saque emergencial em 2020 pode não ter depósito automático; entenda
11,INSS começa a pagar este mês a segunda parcela do 13º salário; veja o calendário e quem tem direito
11,INSS: Mais de 1 milhão à espera por perícia médica
11,INSS: termina nesta sexta o pagamento da primeira parcela do 13º de aposentados e pensionistas; veja quem tem direito
11,Beneficios: Revisão com prazos novos no INSS
11,Aposentadoria do INSS: Como posso encaminhar meu pedido?
11,Quase 2 milhões de pessoas esperam resposta na busca por benefícios do INSS
11,Entenda as condições no INSS para ter uma aposentadoria
11,Auxílio Brasil: parcela de maio começa a ser paga na próxima semana; veja calendário
11,Simulação para novas aposentadorias pelo INSS
11,Saiu! Confira quem poderá receber o Auxílio Brasil de R$ 400 em maio
11,Aposentadorias do INSS com regras diferenciadas: entenda
11,Teto do INSS pode liberar até quanto aos profissionais?
12,Quando os pagamentos serão retomados no benefício Vale-Gás?
12,Saiba quando os pagamentos serão retomados no Vale-Gás
12,Vale-gás: saiba quando os pagamentos serão retomados
13,Guerra na Ucrânia: a busca desesperada por ucranianos sequestrados por russos após invasão
13,"Rússia x Ucrânia: o que é 'guerra por procuração', que Moscou acusa Otan de ter iniciado"
13,Mariupol espera novo comboio da ONU para retirar civis ucranianos
13,"Rússia diz que retirada de civis em Mariupol foi encerrada, e Zelenski fala em nova fase"
13,ONU anuncia segunda retirada de civis de Mariupol
13,Vídeo de drone mostra desfile de Dia da Vitória em Mariupol; ucranianos resistem em usina siderúrgica
13,Ucrânia anuncia que nova tentativa de retirar de civis de Mariupol começou
13,"Corredor humanitário é aberto em Mariupol para retirada de soldados feridos, diz Rússia"
13,GUERRA NA UCRÂNIA: ONU anuncia segunda retirada de civis em Mariupol; Kiev acusa Rússia de romper promessa e invadir último ponto de resistência na cidade
13,Mariupol: Rússia confirma retirada de 265 soldados ucranianos e conquista total da cidade
13,Militares da Ucrânia dizem que terminou a missão de combate em usina siderúrgica que era o último foco de resistência em Mariupol
13,Rússia intensifica ataques em Mariupol para eliminar último foco de resistência na cidade
13,Guerra na Ucrânia: ucranianos são retirados de usina e cerco sangrento a Mariupol chega ao fim com vitória russa
14,"Número de mortes por covid no Brasil pode ter sido 18% maior em 2020, estimam cientistas"
14,"Número real de mortes por covid no mundo pode ter chegado a 15 milhões, diz OMS"
14,OMS: Número real de mortes por covid no mundo pode ter chegado a 15 milhões
15,Kremlin se recusa a dizer se Putin pediu desculpas a Israel por comentários sobre Hitler
15,Putin pede desculpas depois de Lavrov dizer que Hitler era judeu
15,Israel diz que Putin pediu desculpas por falar de chanceler sobre Holocausto
15,Kremlin não dirá se Putin se desculpou após ministro dizer que Hitler tinha origem judaica
15,"Rússia pede desculpas por fala associando Hitler ao judaísmo, diz Israel"
16,"VÍDEOS: EPTV 1 Sul de Minas de segunda-feira, 9 de maio de 2022"
16,"VÍDEOS: AB1 de quarta-feira, 11 de maio"
16,"VÍDEOS: GR1 de Sexta, 13 de maio"
16,"VÍDEOS: DF1 de segunda-feira, 9 de maio de 2022"
16,"VÍDEOS:  Bom Dia Acre desta quinta-feira, 5 de maio"
16,"VÍDEOS: MG1 de sexta-feira, 13 de maio de 2022"
16,"VÍDEOS: Bom Dia Alagoas de quinta-feira, 12 de maio"
16,"VÍDEOS: Boa Noite Paraná de segunda-feira, 9 de maio"
16,"VÍDEOS: EPTV 1 Piracicaba desta segunda-feira, 9 de maio"
16,"VÍDEOS: Bom Dia Alagoas de quarta-feira, 11 de maio"
16,"VÍDEOS: Bom Dia Alagoas de terça-feira, 10 de maio"
16,"VÍDEOS: AL 2 de terça-feira, 10 de maio"
16,"VÍDEOS: NE2 de segunda-feira, 9 de maio de 2022"
16,"VÍDEOS: GR1 de sexta-feira, 13 de maio"
16,"VÍDEOS: AL1 de quinta-feira, 12 de maio"
16,"VÍDEOS: EPTV 1 Campinas de segunda-feira, 9 de maio"
16,"VÍDEOS: SP2 de quinta-feira, 12 de maio de 2022"
16,"VÍDEOS: SP1 de quarta-feira, 11 de maio de 2022"
16,"VÍDEOS: MG2 de quinta-feira, 05 de maio de 2022"
16,"VÍDEOS: EPTV 1 Sul de Minas de terça-feira, 10 de maio de 2022"
16,"VÍDEOS: MG1 de terça-feira, 10 de maio de 2022"
16,"VÍDEOS: RJ2 de terça, 10 de maio de 2022"
16,"VÍDEOS: EPTV 1 Campinas de terça-feira, 10 de maio"
16,"VÍDEOS: Bom Dia Acre desta terça-feira, 10 de maio"
16,"VÍDEOS: Bom Dia Cidade Sul de Minas de quarta-feira, 11 de maio de 2022"
16,"VÍDEOS: Boa Noite Paraná de quinta-feira, 5 de maio"
16,"VÍDEOS: EPTV 2 Piracicaba desta terça-feira, 10 de maio"
16,"VÍDEOS: Bom Dia Cidade Sul de Minas de terça-feira, 10 de maio de 2022"
16,"VÍDEOS: SP2 de terça, 10 de maio"
16,"VÍDEOS: Meio-Dia Paraná de segunda-feira, 9 de maio"
16,"VÍDEOS: AB1 de terça-feira, 10 de maio"
16,"VÍDEOS: GR1 de Terça-feira, 10 de maio"
16,"VÍDEOS: Bom Dia SP de terça-feira, 10 de maio de 2022"
16,"VÍDEOS: Bom Dia Acre desta segunda-feira, 9 de maio"
16,"VÍDEOS: AB1 de segunda-feira, 9 de maio"
16,"VÍDEOS: NE1 de terça-feira, 10 de maio de 2022"
16,"VÍDEOS: SP1 de segunda-feira, 9 de maio de 2022"
16,"VÍDEOS: GR1 de segunda-feira, 9 de maio"
16,"VÍDEOS: EPTV 1 Campinas desta segunda-feira, 16 de maio de 2022"
16,"VÍDEOS: SP1 de terça-feira, 10 de maio de 2022"
16,"VÍDEOS: AL1 de segunda-feira, 9 de maio"
16,"VÍDEOS: Bom Dia DF de sexta-feira, 6 de maio de 2022"
16,"VÍDEO: MG2 de sexta-feira, 06 de maio de 2022"
16,"VÍDEOS: EPTV 1 Piracicaba deste sábado, 7 de maio"
16,"VÍDEOS: NE2 de quinta-feira, 5 de maio de 2022"
16,"VÍDEOS: Bom Dia Alagoas de segunda-feira, 9 de maio"
16,"VÍDEOS: EPTV 1 Sul de Minas de sexta-feira, 6 de maio de 2022"
16,"VÍDEOS: Bom Dia Cidade Sul de Minas de segunda-feira, 9 de maio de 2022"
16,"VÍDEOS: EPTV 1 Campinas deste sábado, 7 de maio"
16,"VÍDEOS: DF1 de sábado, 7 de maio de 2022"
16,"VÍDEOS: NE1 de sábado, 7 de maio de 2022"
16,"VÍDEOS: Bom Dia Cidade Piracicaba de sexta-feira, 6 de maio"
16,"VÍDEOS: RJ1 de sábado, 7 de maio de 2022"
16,"VÍDEOS: Bom Dia Paraná de sexta-feira, 6 de maio"
16,"VÍDEOS: SP1 de sábado, 7 de maio de 2022"
16,"VÍDEOS: Bom Dia Cidade Sul de Minas de sexta-feira, 6 de maio de 2022"
16,"VÍDEOS: AB1 de sábado, 7 de maio"
16,"VÍDEOS: Bom Dia Cidade Campinas de sexta-feira, 6 de maio"
16,"VÍDEOS: Bom Dia PE de sexta-feira, 6 de maio de 2022"
16,"VÍDEOS: Bom Dia SP de segunda-feira, 9 de maio de 2022"
16,"VÍDEOS: Bom Dia Cidade Piracicaba de segunda-feira, 9 de maio"
16,"VÍDEOS: Bom Dia Cidade Campinas de segunda-feira, 9 de maio"
16,"VÍDEOS: Bom Dia Paraná de segunda-feira, 9 de maio"
16,"VÍDEOS: Bom Dia Acre desta sexta-feira, 6 de maio"
16,"Resumo do dia: Paraná, segunda-feira, 16 de maio de 2022"
16,"VÍDEOS: Bom Dia Alagoas de sexta-feira, 6 de maio"
16,"VÍDEOS: Bom Dia SP de sexta-feira, 6 de maio de 2022"
16,"VÍDEOS: AL1 de sábado, 7 de maio"
16,"VÍDEOS: EPTV 2 Sul de Minas de quinta-feira, 5 de maio de 2022"
16,"VÍDEOS: EPTV 1 Sul de Minas de sábado, 7 de maio de 2022"
16,"VÍDEOS: Meio Dia Paraná de sábado, 6 de maio"
16,"VÍDEOS: NE2 de sexta-feira, 6 de maio de 2022"
16,"VÍDEOS: DF1 de sexta-feira, 6 de maio de 2022"
16,"VÍDEOS: EPTV 2 Campinas de sexta-feira, 6 de maio"
16,"VÍDEOS: EPTV 1 Piracicaba desta sexta-feira, 6 de maio"
16,"VÍDEOS: MG1 de segunda-feira, 9 de maio de 2022"
16,"VÍDEOS: GR1 de sábado, 7 de maio"
16,"VÍDEOS: RJ2 de sexta, 6 de maio de 2022"
17,"Exportações superam importações em US$ 8,148 bi em abril, abaixo do esperado"
17,"Balança comercial registra superávit de US$ 8,1 bilhões em abril"
17,"Balança comercial tem superávit de US$ 8,1 bilhões em abril"
17,"Brasil tem superávit comercial de US$8,148 bi em abril, abaixo do esperado"
18,Senac abre vagas em cursos de capacitação pelo Brasil
18,CDL Garanhuns oferece vagas para cursos gratuitos de vendas e auxiliar administrativo
18,"Senac abre 140 vagas para cursos técnicos presenciais gratuitos, no Paraná"
18,Movimento Pró-Criança abre 100 vagas para cursos gratuitos presenciais; saiba como se inscrever
18,IFRR abre 170 vagas em curso EAD gratuito de Recepcionista
18,Escola de Gastronomia Social oferta 140 vagas gratuitas em cursos profissionalizantes presenciais
18,Limeira abre vagas para cursos de artesanato; veja horários disponíveis e como se inscrever
18,Projeto Primeiro Passo oferece 150 vagas em cursos online para qualificação de jovens no Ceará
18,"Macaé, RJ, abre pré-inscrição  para cursos gratuitos de qualificação"
18,Limeira abre vagas para curso gratuito de confeitaria; veja como se inscrever
18,Senai oferta mais de 250 vagas em cursos gratuitos de informática no Paraná
18,Escola de Gastronomia Social oferta 140 vagas em cursos presenciais em Fortaleza
18,Senai em Araripina abre inscrições para cursos técnicos gratuitos e oferece mais de 150 vagas
19,"Motorista perde controle do carro, bate em poste e capota na Via Costeira em Natal"
19,"Jovem tem morte cerebral após acidente durante racha entre caminhonete e BMW, em avenida de Goiânia"
19,Motociclista fica ferido após bater contra um carro e imagens são impressionantes
19,Vídeo mostra momento em que carro bate em poste e grávida de oito meses perde bebê; acidente aconteceu após chá de fraldas
19,Moto é despedaçada e pega fogo após bater contra carro em Londrina
19,"Motorista perde controle da direção de carro e bate em poste, em Curitiba"
19,"Motorista bate carro contra árvore no bairro Rebouças, em Curitiba, e fica ferida"
19,Carro capota durante racha e jovem morre após ser arremessada de veículo; veja vídeo
19,Caminhonete quase bate em outro carro ao capotar durante racha que matou adolescente em Goiânia; vídeo
19,Motorista que bateu em carro e matou homem vai a júri popular no DF
19,VÍDEO | Homem com carro roubado é preso após bater em muro durante perseguição em Vitória
19,Homem é socorrido após colisão contra poste no Anel Viário em Pinda
19,Vídeo: carro invade bar após motorista perder controle de carro
19,Homem fica ferido após carro derrubar poste em Jaú
19,"VÍDEO: Jovem perde controle do veículo e bate em poste em Maringá, diz polícia"
20,Polícia prende quadrilha suspeita de aplicar golpes em idosos
20,Casal suspeito de aplicar golpe da pirâmide é preso na Grande BH
20,Polícia prende suspeita de aplicar golpe da casa própria em pelo menos oito pessoas
20,Casal suspeito de aplicar golpes é preso na Grande BH
20,"Prisão de casal suspeito de aplicar golpes em esquema de pirâmide é estendida por mais 5 dias, diz polícia"
21,"Mais de 30,6 mil adolescentes tiraram o primeiro título de eleitor neste ano em MT"
21,2 milhões de jovens tiraram o título de eleitor pela primeira vez
21,"Apesar de campanhas, número de jovens com título de eleitor cresce apenas 1,26% no DF"
21,Quase 9 milhões de pessoas procuraram os cartórios para regularização e emissão do título de eleitor
22,Imposto de Renda para Pessoas Físicas: Prazo acaba dia 31 de maio
22,Imposto de Renda: Por que declarar os recebimentos para a Receita?
22,Prazo para pagamento do IPTU vence nesta segunda (16)
22,Rendimento de pensão por morte do INSS deve ser declarada no Imposto de Renda?
22,"IRPF: A menos de um mês do fim do prazo, apenas 55% dos paranaenses fizeram as declarações"
22,"Imposto de Renda 2022: a 2 semanas do fim do prazo, Receita ainda aguarda quase 12 milhões de declarações"
22,Imposto de Renda 2022: faltam duas semanas para o fim do prazo; agilize a separação de documentos
22,Imposto de Renda 2022: Receita Federal alerta sobre novo golpe envolvendo restituição
22,INSS: como declaro rendimento de pensão por morte no Imposto de Renda?
22,Imposto de Renda 2022: Recebo aluguel e pago IPTU; posso descontar o valor?
22,Imposto de Renda 2022: Investiu em ações? Tem que declarar
22,Imposto de Renda 2022: quem tem imposto a pagar e quer colocar 1ª cota no débito automático deve entregar declaração até esta terça
22,Prazo para pagar Imposto de Renda no débito vence nesta terça-feira (10)
22,Entenda o que é ITBI e quando o imposto deve ser pago
22,Entrega de declarações do Imposto de Renda 2022 superam 22 milhões
22,Entrega de declarações do Imposto de Renda 2022 ultrapassa 22 milhões
22,"Imposto de Renda 2022: saquei FGTS, preciso declarar?"
22,Imposto de Renda: Brasileiro tem até hoje para pagar em débito automático em seu banco
22,Imposto de Renda 2022: quem vendeu o carro com lucro precisa pagar tributos; saiba como
22,"IR 2022: a 2 semanas do fim, Receita espera quase 12 milhões de declarações"
22,MEI deve declarar os rendimentos no Imposto de Renda da Receita Federal?
22,Imposto de Renda 2022: como declarar empréstimo consignado?
22,Receita Federal alerta para golpe na restituição do Imposto de Renda
22,Restituição do Imposto de Renda 2022: saiba o calendário e como consultar
22,"Imposto de Renda 2022: a 3 semanas do fim do prazo, Receita ainda aguarda 14 milhões de declarações"
22,Preciso declarar saques do FGTS no Imposto de Renda 2022?
22,Imposto de Renda 2022: Saiba como declarar fundos imobiliários
22,IRPF: veja como incluir imposto a pagar em débito automático
22,Mais de 19 milhões de declarações do Imposto de Renda já foram entregues
22,Como recuperar o recibo do Imposto de Renda?
22,"Imposto de Renda 2022: saiba como declarar doações, e como doar direto na declaração"
23,Mais de 500kg de cocaína são encontrados na Suíça em contêiner de café enviado do Brasil para a Nespresso
23,Suíça encontra 500 kg de cocaína enviada do Brasil em entrega de café para Nespresso
23,Nespresso na Suíça encontra 500 kg de cocaína em sacos de café importados do Brasil
23,Polícia apreende R$ 257 milhões em cocaína vinda do Brasil em fábrica de café na Suíça
23,Funcionários da Nespresso na Suíça encontram 500 kg de cocaína em remessa de café vinda do Brasil
24,"Três pessoas morrem em ataque na cidade de Elad, centro de Israel"
24,Polícia de Israel identifica três suspeitos pelo ataque que deixou três mortos em Elad
24,Ataque deixa pelo menos três mortos durante celebração da independência de Israel
24,Ataque em cidade israelense de Elad deixa três mortos
25,Por que bitcoin perdeu metade do seu valor em 6 meses: resumo
25,"Dólar sobe pela 3ª semana, a R$ 5,075; Bolsa cai ao menor nível em 4 meses"
25,Bitcoin despenca 57% em seis meses e já tem menor valor em quase um ano
25,"Dólar fecha acima de R$ 5 e bolsa despenca, após alta de juros"
25,Bitcoin mantém desvalorização e registra menor valor em quase 1 ano
25,Bitcoin perde metade do valor em 6 meses: estamos vivendo um ‘criptoinverno’?
25,Bitcoin enfrenta desvalorização e alcança menor valor em três meses
25,"Bolsa sobe 1,24% e dólar fica quase estável, cotado a R$ 5,141"
25,Bitcoin entra em queda e atinge o menor valor desde julho de 2021
25,"Dólar sobe 2,3%, a R$ 5,017; Bolsa cai 2,81%, ao menor nível em 4 meses"
25,Dólar sobe após renovar pico em 20 anos no exterior
25,"Bitcoin volta a passar de US$ 30 mil, mas perdas no ano ainda passam de 30%"
25,"Bitcoin ultrapassa os US$ 30 mil, mas tem perdas na semana"
25,"Dólar fecha acima de R$ 5, e Bolsa recua 2,81%"
25,Bitcoin cai ao nível mais baixo desde julho do ano passado com piora dos  mercados acionários
25,"Dólar sobe a R$ 5,157, valor mais alto em quase dois meses; Bolsa cai"
26,STF dá 24 meses para Conama editar norma mais rigorosa sobre padrão de qualidade do ar
26,Supremo dá prazo de 24 meses para Conama editar nova norma sobre qualidade do ar
26,STF determina que Conama atualize resolução sobre qualidade do ar
26,STF dá 24 meses para Conama editar normas mais eficientes sobre padrão de qualidade do ar
27,Coreia do Norte registra mais 8 mortes após surto de Covid-19
27,São Carlos registra morte por Covid-19 pelo segundo dia seguido
27,Coreia do Norte confirma 1ª morte por Covid-19 desde o início da pandemia
27,Covid na Coreia do Norte: do 1º caso confirmado a 1 milhão com 'febre' em menos de uma semana
27,"Acre não registra mortes e novos casos de Covid-19 pelo 7º dia, aponta boletim da Sesacre"
27,Covid-19: Amapá registra 1 novo caso conhecido da doença; são 3 pacientes internados
27,"Em três semanas, casos de dengue crescem 40% em todo o país; total de infectados vai a 750 mil"
27,"Sob ‘lockdown’, Coreia do Norte registra mais de 1 milhão de casos de ‘febre’"
27,Araraquara registra morte por Covid-19 pelo segundo dia consecutivo e mais 239 casos
27,Sergipe registra oito casos conhecidos de Covid-19
27,"Em mais um dia sem mortes, Alagoas registra 109 novos casos de Covid"
27,Covid-19: Amapá não registra mortes e tem apenas 1 novo caso pela doença; 2 estão internados
27,Coreia do Norte confirma casos de Covid pela primeira vez desde o início da pandemia
27,"Pelo segunda dia consecutivo, Acre não registra novos casos e nem mortes por Covid-19"
27,Covid-19: Brasil tem 14.622 casos e 35 mortes em 24 horas
27,Acre não confirma novos casos e nem mortes por Covid nesta sexta-feira (6)
27,"Com mais 639 infectados e quatro mortes por Covid-19, Pernambuco registra 930.411 casos e 21.657 óbitos"
27,RS chega a 29 mortes por dengue; já são 24 mil casos este ano
27,Sergipe registra uma morte e 10 casos conhecidos de Covid-19
27,Sergipe registra dezoito casos conhecidos de Covid-19 e nenhuma morte
27,"Com mais 800 infectados e quatro óbitos por Covid-19, Pernambuco totaliza 927.214 casos e 21.636 mortes"
27,"Covid-19: Brasil registra 46 mortes e 6,2 mil novos casos da doença em 24 horas"
27,"Covid-19: Brasil tem 9,7 mil novos casos e 53 mortes em 24 horas"
27,Coreia do Norte anuncia primeira morte por covid e surto nacional da doença
27,Tocantins contabiliza 78 novos casos de Covid e uma nova morte pela doença
27,Alagoas tem mais um dia sem mortes por Covid e registra 42 novos casos
27,Coreia do Norte confirma 1ª morte por Covid na pandemia
27,Bahia volta a não registrar mortes por Covid-19; estado tem 270 casos ativos da doença
27,"Covid-19: em 24 horas, Brasil teve 20 mil novos casos e 198 mortes"
27,"Covid: Brasil registra 137 mortes em 24 horas, diz Conass"
27,Coreia do Norte confirma primeira morte por covid-19
27,Pará registra 769.738 casos e 18.309 mortes por Covid-19
27,Coreia do Norte reconhece primeiro surto de Covid-19 e decreta confinamento nacional
27,Americana registra sexta morte por dengue no ano; casos sobem 45% em duas semanas
27,Sergipe registra 20 casos conhecidos de Covid-19
27,Coreia do Norte registra 6 mortes e 270 mil 'casos de febre' em 24 horas em meio a surto de Covid-19
27,Pernambuco registra mais 69 casos de Covid-19 e quatro mortes
27,Coreia do Norte divulga pela primeira vez surto de Covid-19
27,Covid-19: Amapá contabiliza 1 morte ocorrida em abril e registra 5 novos casos da doença
27,"Em uma semana, Alagoas registra 674 casos de dengue"
27,Amazonas tem nove novos casos e nenhuma morte por Covid-19
27,Sergipe registra 12 casos conhecidos de Covid e nenhuma morte
27,"Sem novos casos e mortes, Acre já tem quase 123 mil pessoas curadas da Covid-19"
28,Covid-19: veja boletim da Prefeitura de Uberaba de 07/05/2022; município supera os 100 casos pelo 4º dia seguido
28,Covid-19: veja boletim da Prefeitura de Uberlândia de 05/05/2022; informativo não conta com mortes
28,"Covid-19: veja boletim da Prefeitura de Uberaba de 09/05/2022; taxa de transmissão vai a 1,62"
28,Covid-19: veja boletim da Prefeitura de Uberaba de 10/05/2022; casos crescem e cidade registra mais de 300 novos infectados
28,Covid-19: veja boletim da Prefeitura de Uberlândia de 09/05/2022; município confirma morte pelo 2º dia seguido
28,Covid-19: veja boletim da Prefeitura de Uberlândia de 07/05/2022
28,Covid-19: veja boletim da Prefeitura de Uberaba de 05/05/2022
28,Covid-19: veja boletim da Prefeitura de Uberlândia de 17/05/2022; mais de 150 casos são notificados na cidade
29,"VÍDEOS: BDRO de segunda-feira, 9 de maio de 2022"
29,"VÍDEOS: BDRO de sexta-feira, 6 de maio de 2022"
29,"VÍDEOS: JRO1 de quinta-feira, 5 de maio de 2022"
30,"Bloquetes soltos em rua que é rota de ambulâncias causam reclamação em Ribeirão Preto, SP"
30,"UBS tem atendimentos suspensos após infiltrações durante chuva em Ribeirão Preto, SP"
30,"Trabalhadores ficam feridos após caírem de estrutura no recinto da Agrishow em Ribeirão Preto, SP"
30,"Ladrões furtam de maçaneta a placa de trânsito em Ribeirão Preto, SP"
31,"Biden nomeia Karine Jean-Pierre como porta-voz da Casa Branca, primeira mulher negra no cargo"
31,Biden nomeia 1ª porta-voz negra da Casa Branca
31,Joe Biden nomeia a primeira mulher negra para o cargo de porta-voz da presidência dos EUA
31,EUA nomeiam primeira mulher negra como porta-voz da Casa Branca
32,"Casal e filho morrem em acidente na BR-365, em Buritizeiro"
32,Sogro e genro morrem após acidente na BR-376
32,"Sogro e genro são as vítimas fatais de acidente na BR-376, em Marialva"
33,Sine Maceió disponibiliza 141 vagas de emprego nesta segunda; confira
33,Sine de Porto Velho oferta mais de 30 vagas de emprego nesta segunda-feira (9)
33,Sine Maceió oferta 152 vagas de emprego para todos os níveis
33,Sine Municipal oferta 691 vagas de trabalho em Fortaleza
33,Sine Acre oferece 46 vagas de emprego nesta sexta-feira (6); confira a lista
33,Sine Acre oferece 45 vagas de emprego nesta segunda-feira (9); confira a lista
33,158 vagas de emprego são ofertadas pelo Sine Manaus nesta sexta (6); veja cargos
33,Sine de Porto Velho oferta mais de 35 vagas de emprego nesta sexta-feira (6)
33,Sine Macapá oferta oportunidades de emprego em 13 áreas; veja as vagas para 17 de maio
33,Sine de Porto Velho oferta quase 40 vagas de emprego nesta quarta-feira (11)
33,Sine oferta 525 vagas de trabalho em Fortaleza
33,Sine oferta 76 vagas de emprego em Ivaiporã nesta segunda
33,"Eletricista, consultor de vendas: Sine em RR oferta 24 vagas de emprego nesta sexta-feira (6)"
33,"Sine Maceió oferta vagas de emprego nas áreas de açougue, confeitaria e jardinagem"
33,Sine Acre oferece 50 vagas de emprego nesta terça-feira (10); confira a lista
33,"Atendente de padaria, operador de caixa: Sine em RR oferta 43 vagas de emprego nesta terça-feira (10)"
33,SineBahia oferece vagas de emprego em Itabuna nesta segunda-feira; veja lista
34,Cidade Alerta Paraná Ao Vivo | 05/05/2022
34,Cidade Alerta Oeste Ao Vivo | 05/05/2022
34,Cidade Alerta Maringá Ao Vivo | 05/05/2022
34,Cidade Alerta Londrina Ao Vivo | 05/05/2022
35,Homem que recebeu coração transplantado de porco pode ter contraído vírus suíno
35,Homem que recebeu coração de porco morreu infectado por vírus suíno
35,Coração de porco usado em transplante tinha vírus suíno
35,Transplantado com coração de porco pode ter morrido por vírus suíno
