cluster,titulo
1,Caso Lucilene: testemunha é morta após tentar falar com família da vítima
1,"Motorista de aplicativo preso após assalto conhecia criminosos e adulterou placa do carro, diz SSP"
1,"Motorista morre após ter carro parado no acostamento atingido por picape em Jaboticabal, SP"
1,Segundo suspeito de envolvimento na morte de gari é preso pela Polícia Civil no AM
1,Caso Josué: Ex-policial penal é condenado a 11 anos e 4 meses de prisão em regime fechado
1,Caso Lucilene: possível testemunha morre após tentar falar com família
1,Motoristas morrem após caminhões baterem de frente na BR-153 em Ribeirão do Sul
1,Suspeito morre e outro fica ferido em troca de tiros com policiais no Complexo do Salgueiro (RJ)
1,Suspeito é morto a tiros durante assalto na Zona Leste de Teresina; cúmplice fugiu com pertences de vítima
1,Homem é preso suspeito de esfaquear companheira e filha grávida no Interior de SP
1,"Suspeito é preso durante assalto a micro-ônibus na BR-101, em Laranjeiras"
1,"Homem é preso por manter companheira em cárcere privado em Santana do Ipanema, AL"
1,Polícia Federal prende suspeita de aliciar brasileiros detidos por tráfico de drogas na Tailândia
1,PM à paisana reage a tentativa de assalto e mata suspeito dentro de loja de eletrodomésticos no interior do AC
1,Acusado de matar amiga da ex-mulher dele por ciúmes é preso em MT
1,Caso Mônica de Oliveira: marido afirma briga de casal e diz que é dono da arma usada na morte de juíza
1,Carro atropela cavalo e mulher morre em acidente em rodovia de Araçatuba
1,"Paranaense preso por tráfico de drogas na Tailândia telefona aos pais após dois meses: 'Pediu que mandasse uma Bíblia, para que pudesse refletir', diz advogado"
1,Caso Heloá: vizinho que confessou ter estuprado e matado menina de 11 anos vai a júri em novembro deste ano
1,Homem é preso por agredir e manter namorada em cárcere privado no Rio de Janeiro
1,Suspeito de matar e esquartejar vendedor que foi confundido com policial militar é preso em SP
1,Tiroteio na Holanda deixa dois mortos
1,Homem é preso após confessar assassinato de ex em Contagem (MG)
1,"'Eu estou nessa idade e nunca pensei em ver isso', diz irmão da mulher morta a tiros em Gravatá"
1,Jovem é morto com vários tiros dentro de casa em Governador Valadares
1,"Vídeo mostra brasileiros suspeitos de tráfico internacional de drogas na Tailândia com suposta aliciadora em aeroporto antes de embarque, diz PF"
1,"'Professora, se um pai bater na filha é crime?', pergunta criança após afirmar ter recebido chineladas em BH"
1,Homem é preso pela Polícia Civil por suspeita de envolvimento com roubos em Muriaé e região
1,Quatro pessoas são presas por tráfico de drogas em Porto Velho
1,"Quase dois anos após matar grávida e roubar bebê em Ituiutaba, quatro acusados aguardam julgamento"
1,Homem persegue esposa com facão após vítima voltar de festa familiar em RO
1,Homem ligado ao PCC e suspeito de fornecer de explosivos para crimes no litoral de SP é preso
1,"Acidente entre carro e caminhonete deixa um morto na BR-235, no norte da Bahia; outras cinco pessoas ficaram feridas"
1,Mototaxista de São Gonçalo fica mais de 2 anos preso injustamente após reconhecimento por fotos
1,Mulher é presa suspeita de esfaquear homem no metrô de SP
1,Homem é preso após tentar matar ex-esposa a facadas
1,Jovem morre atingido por bala perdida durante troca de tiros entre suspeitos e um policial aposentado na Zona Sul de SP
1,Acusado do assassinato de duas crianças em Viçosa do Ceará é condenado a 50 anos de prisão
1,Homem que agrediu namorada por 3 dias já foi preso por espancar a mãe do seu filho: ‘Não vai sair viva’
1,"Homens morrem após troca de tiros com policiais no bairro de Pernambués, em Salvador"
1,"Dois anos após morte de policial, viúva ainda aguarda prisão de criminosos"
1,Mulher tem apartamento invadido e é morta com golpes de faca em Rio Branco
1,Ex-detento é morto a tiros após desentendimento por ocupação de terra na Zona Leste de Teresina
1,"Homem é condenado a mais de 30 anos de prisão por matar a ex-mulher enquanto ela implorava para não ser morta, em Planaltina de Goiás"
1,"Condição financeira de brasileiros presos por tráfico na Tailândia indica que foram aliciados, diz PF"
2,"Rainha 'ronronou' ao saber que Escócia rejeitou independência, diz premiê britânico"
2,Por que a Escócia rejeitou a independência?
2,"Independência da Escócia seria 'divórcio', diz premiê britânico"
2,Escócia rejeita independência: e agora?
3,Polícia Civil do RN abre inquérito para investigar entrada de bilhetes de criminosos em presídios por meio de advogados
3,Operação da Polícia Federal apreende armamento suspeito em Dois Córregos
3,Polícia Civil de Juiz de Fora recebe denúncia de mais uma empresa que teve contêineres desviados
3,MP e Polícia Civil investigam denúncias de maus-tratos dentro de abrigo para mulheres em SC
3,Dois acusados se apresentam na sede da Polícia Federal após operação que investiga fraudes em licitações na Educação e Saúde
3,Polícia Civil identifica suspeitos do roubo milionário da conta da Prefeitura de Campinas
3,Polícia do Rio deflagra ação contra fraudes em licitações públicas
3,Polícia Civil investiga suspeita de envenenamento de sete cães encontrados mortos em Limeira
3,Suspeitos de roubo são localizados com ajuda de câmera térmica no DF
3,Câmera térmica ajuda polícia a localizar suspeitos de roubo no DF
3,"Policia Civil de Campinas realiza ""Operação Falso Insumo"""
4,Governo diz ao STF que perdão a Daniel Silveira é constitucional e não gera crise entre poderes
4,Orçamento Secreto: STF recebe mais de 400 explicações de parlamentares no relatório
4,Defesa pede que TSE divulgue sugestões das Forças Armadas ao processo eleitoral
4,AGU defende indulto a Daniel Silveira e diz que ato não gera crise
4,Troca no MME indica que Bolsonaro quer ir para a guerra contra o que chama de 'abusos' da Petrobras
4,AGU diz ao Supremo que indulto de Bolsonaro a Daniel Silveira é constitucional
4,"Castro diz que apoia Bolsonaro, mas não vai criticar Lula"
4,"Bolsonaro 'acha que artista é tudo comunista', diz Lula em Contagem (MG)"
4,"'Espiões' de Bolsonaro na Petrobras miram em diretores, diz jornal"
4,"Orçamento 'secreto': o que o STF decidiu, o que o Congresso divulgou e o que falta saber"
4,Caso Isa Penna: Deputado se nega a contar o que Cury disse antes de assédio
4,Planalto responde ao STF que perdão ao deputado Daniel Silveira é constitucional
4,TSE diz à Defesa não se opor à divulgação de sugestões das Forças Armadas
4,Presidente do TSE não se opõe à divulgação de sugestões de militares sobre eleições
4,Estagiaria da Câmara de Taubaté denuncia vereador por ameaça
4,Ciro pede que todos os candidatos se unam contra tentativa de golpe de Bolsonaro
4,PGR pede arquivamento de inquérito contra Ciro Nogueira
4,"Ao Ministério da Defesa, TSE diz que concorda com divulgação de documentos"
4,"Fachin, à Defesa: documentos sobre processo eleitoral podem ser divulgados"
4,"Caso Daniel Silveira: Legislativo deve paralisar crise que Bolsonaro tenta criar, diz deputada"
4,Câmara de Caçapava aceita denúncia com pedido de cassação de vereador que agrediu vereadora
4,"Em carta a presidente do PSDB, Doria cobra respeito a prévias e diz ser alvo de 'tentativas de golpe'"
4,Mendonça declara suspeição e não julgará ação contra dossiês do governo Bolsonaro
4,Caso Daniel Silveira: AGU diz ao STF que graça concedida por Bolsonaro é constitucional
4,"Motociatas de Bolsonaro são gastos sem sentido, ainda que TSE não veja crime eleitoral, diz advogado"
4,TSE confirma que qualquer partido pode auditar eleições após falas de Bolsonaro
4,Motociatas de Bolsonaro: Deputado entra com ação no TSE por gastos do presidente
4,PGR pede que inquérito sobre ex-ministro Milton Ribeiro saia do STF
4,"Genial/Quaest: Lula e Bolsonaro empatam nas intenções de voto no RJ, com 35% cada"
4,Eleições: pesquisa CNI aponta Lula com 40% e Bolsonaro com 32%
4,Rodrigo Pacheco defende poder judiciário e Fachin responde críticas de Bolsonaro
4,"TSE foi ingênuo e Bolsonaro está se aproveitando, diz Renan sobre militares nas eleições"
4,Pronunciamento de Michelle Bolsonaro: Ministro que vetou política no Lolla analisará ação
4,"TSE convidar Forças Armadas para eleições gera instabilidade e abre chance para ataque, diz professor"
4,Ministério da Defesa pede que TSE divulgue proposta das Forças Armadas para as eleições de outubro
4,Ministro da Defesa cobra que TSE divulgue sugestões dos militares para as eleições
4,"TJ do Rio arquiva denúncia do MP contra Flávio Bolsonaro em caso das ""rachadinhas"""
4,TSE rejeita consulta de Eduardo Bolsonaro sobre comprovante de vacina nas eleições
4,Bolsonaro diz que seu partido vai contratar empresa para fiscalizar eleições
4,Juiz suspende CPI presidida por vereador acusado de racismo na Câmara de SP
4,TSE responde Forças Armadas e rejeita sugestões para as eleições
4,Comissão de Justiça da Câmara rejeita recurso de Gabriel Monteiro; prazo para defesa termina nesta segunda
4,"'Veto de Bolsonaro à cultura deve ser derrubado', diz Pacheco"
4,"Bolsonaro comemora decisão do STF favorável ao governo: ""Com Kassio não seria diferente"""
4,"'Contrataremos empresa para fazer auditoria nas eleições', diz Bolsonaro"
4,Bolsonaro exalta Mendonça após decisão favorável no STF: 'Indicado por mim'
4,"Petrobras anuncia aumento; Bolsonaro e Lula, militares nas eleições e mais notícias | UOL News 09/05/22"
4,Gilmar Mendes determina alteração de regras e reabertura do prazo para inscrição de candidatos na eleição indireta em Alagoas
4,Pacheco: 'Não podemos admitir sequer uma bravata sobre fechamento do STF'
4,Ministério da Defesa pede ao TSE liberação de documentos sobre eleições
4,"Michelle Bolsonaro fazer pronunciamento ao lado de ministra é estranho e ilegal, diz Josias de Souza"
4,"Pacheco: ""Não podemos admitir sequer uma bravata"""
4,"STF cancela edital, e Alagoas terá de mudar forma de eleição para o governo"
4,Bolsonaro diz que PL vai contratar auditoria externa para as eleições
4,TSE diz que responderá à Defesa sobre sugestões ao sistema eleitoral até quarta-feira (11)
4,"Em ofício, ministro da Defesa diz que quer centralizar demandas no TSE"
4,Bolsonaro diz que PL vai contratar empresa para auditar sistema eleitoral
4,Bolsonaro nega conversa com diretor da CIA sobre eleições
4,Bolsonaro diz que eleição pode ser conturbada; Doria pressiona o PSDB
4,Câmara do Rio rejeita recurso da defesa de Gabriel Monteiro contra processo disciplinar
4,Governo nega que Bolsonaro recebeu conselho da CIA para não duvidar do sistema eleitoral do Brasil
4,Ministro do TSE que vetou manifestações políticas no Lollapalooza analisará ação do PT contra Michelle e Bolsonaro
4,Ministério da Defesa pede que TSE divulgue sugestões das Forças Armadas para as eleições
4,Ministro da Defesa pede que TSE divulgue dúvidas de militares sobre eleições
4,"Bolsonaro só entrega crise em Brasil que precisa de presidente que trabalhe, diz Josias de Souza"
4,"Pix foi planejado na gestão Temer; 'Bolsonaro se apropria de projetos alheios', diz Josias de Souza"
4,"Bolsonaro em 'lanchaciata', Petrobras, Lula e eleição em Alagoas, frio no Brasil e mais | UOL News"
4,"Convite do TSE às Forças Armadas não previu exploração política de Bolsonaro, diz Reale Jr."
4,TJ-RJ arquiva denúncia contra Flávio Bolsonaro no caso de 'rachadinhas' entre 2002 e 2018
4,Vereador Gabriel Monteiro apresenta defesa ao Conselho de Ética
4,Gleisi diz que 'dá vontade de dar um tapa' em manifestante contrária a Lula
4,"Pesquisa CNT/MDA: Sem Moro pela 1ª vez, Lula tem 40,6%, e Bolsonaro, 32%; Sakamoto analisa"
4,STF libera a eleição indireta para governador de Alagoas
4,Congresso informa ao STF quais parlamentares usaram 'orçamento secreto' em 2020 e 2021
4,Orçamento secreto: 406 parlamentares respondem e relatório é enviado ao STF
4,"Diretor da CIA disse que Bolsonaro não deveria lançar dúvidas sobre sistema eleitoral, aponta agência"
4,Gabriel Monteiro protocola defesa prévia de processo no Conselho de Ética da Câmara do Rio
4,Congresso diz ao STF que 404 parlamentares entregaram dados sobre emendas de relator liberadas
4,Justiça do Rio rejeita denúncia de prática de rachadinha contra Flávio Bolsonaro
4,"Mourão e Bolsonaro sobre AI-5, Suécia e Otan, Lula no RJ, Doria, Haddad e mais notícias | UOL News"
4,Caso das 'rachadinhas': Tribunal do RJ arquiva denúncia contra Flávio Bolsonaro
4,"Bolsonaro perdeu controle da agenda da eleição; pauta é fome, não 'kit gay', diz presidente do PSOL"
4,"'Não vamos nos intimidar', diz Moraes sobre ataques ao processo eleitoral"
4,TSE responde às Forças Armadas sobre segurança das urnas eletrônicas
4,TSE responde à Defesa que não se opõe à divulgação de documentos sobre processo eleitoral
4,Bolsonaro provoca STF e TSE e diz que nunca vai ser preso
4,Bolsonaro demite ministro em busca de discurso eleitoral
4,"Apuração de voto cabe apenas à Justiça Eleitoral e não há motivo para questionar urnas, diz Pacheco"
4,"Flávio Dino fala ao vivo de eleições e mais; Lula, Alckmin, Bolsonaro, CIA, União Brasil| UOL News"
4,"Após fala de Bolsonaro, TSE reafirma que permite a partidos que auditem eleição"
4,"'Ninguém e nada vai interferir na Justiça Eleitoral', afirma Fachin"
4,"Lula fala de capa da Time, Bolsonaro critica lucro da Petrobras; CIA, TSE e + notícias | UOL News"
4,"AGU no caso Wal do Açaí e Bolsonaro é dinheiro público jogado pela janela, diz Josias de Souza"
4,Carlos Viana diz contar com Bolsonaro e defende debate sobre urnas eletrônicas
4,Procurador-geral do Rio pede anulação de denúncia contra Flávio Bolsonaro
4,Bolsonaro usa contra TSE tática do punguista
4,Gleisi Hoffmann ataca manifestante anti-Lula: ‘Vontade de dar um tapa’
4,"Diretor da CIA disse ao governo Bolsonaro para não levantar dúvidas sobre sistema eleitoral, segundo agência"
4,"Bolsonaro diz que Moraes, do STF, 'infelizmente' suspendeu redução de IPI"
4,Advogado de Bolsonaro diz que auditoria fortalece transparência eleitoral
4,Nunes Marques pede vista e adia julgamento no STF sobre eleição indireta em Alagoas
4,Mourão diz que decisões do STF sobre Daniel Silveira são 'ataque à democracia'
4,STF mantém eleição indireta em Alagoas
4,Pacheco critica proposta de Bolsonaro de auditoria privada e diz que responsabilidade por eleições é da Justiça Eleitoral
4,"Carro de Lula cercado é prenúncio do que está por vir na campanha presidencial, diz Josias de Souza"
4,Deputados do PT pedem para PGR investigar Bolsonaro por ter questionado se apoiador negro pesava 'mais de 7 arrobas'
4,Segunda Turma do STF dá 120 dias para MP do Rio concluir inquérito sobre Lindbergh na Justiça Eleitoral
4,Indicado antes de Coelho diz que Bolsonaro confunde Petrobras com o governo
4,Comissão da Câmara convida Guedes para explicar possibilidade de reajuste a forças de segurança
4,"Bolsonaro implica com perspectiva de derrota ao falar de auditoria privada, diz Josias de Souza"
4,Conselho de Ética abre processo contra Eduardo Bolsonaro por ataques a Miriam Leitão
4,Presidente diz que Forças Armadas não vão interferir nas eleições
4,Gerson Camarotti: 'Resposta à tentativa de uso político das Forças Armadas para criar uma suspeição nessas eleições'
4,"Bolsonaro 'estupra a lógica' ao fazer declaração sobre lucro da Petrobras, diz Josias de Souza"
4,Corregedor nomeia vereadora negra para relatar processo de racismo contra Camilo Cristófaro na Câmara Municipal de SP
4,"Lula tem 44% das intenções de voto, Bolsonaro 31% e Ciro 8%, diz pesquisa Ipespe"
4,"Pesquisa Quaest no RJ, casamento de Lula, Rodrigo Maia ao vivo, Finlândia na Otan e mais notícias"
4,Bolsonaro pergunta a apoiador negro se ele pesa 'mais de sete arrobas' e diz: 'Sabia que já fui processado por isso?'
5,Presidente do Peru nega plágio em dissertação de mestrado
5,Procuradoria do Peru abre investigação por denúncia de plágio em dissertação de mestrado do presidente do país
5,Universidade peruana conclui que presidente não cometeu plágio em tese
5,Procuradoria do Peru abre investigação por denúncia de plágio em dissertação de Castillo
6,Senado aprova projeto que eleva idade máxima para nomeação em tribunais superiores
6,Congresso promulga emenda que fixa piso de 2 salários mínimos para agentes comunitários de saúde
6,Senado aprova PEC que muda piso salarial dos agentes de saúde
6,Senado aprova PEC que eleva para 70 anos limite para indicação a tribunais
6,Senado aprova aumento da idade máxima para indicados ao STF e tribunais superiores
6,Congresso promulga piso salarial de agentes comunitários de saúde
6,Congresso promulga emenda que eleva para 70 anos idade limite de nomeação em tribunais superiores
7,"Câmara aprova projeto que fixa piso salarial para enfermeiros, técnicos, auxiliares e parteiras"
7,Profissionais de enfermagem pressionam Câmara por piso salarial
7,Câmara aprova piso salarial para profissionais da enfermagem
7,Câmara aprova piso para profissionais da enfermagem
7,Câmara aprova piso salarial para enfermeiros
8,Auxílio Brasil: Senado aprova valor mínimo permanente de R$ 400
8,Senado aprova MP com piso permanente de R$ 400 para Auxílio Brasil
8,Senado aprova projeto que deduz do IR gasto com remédio de alto custo para uso contínuo
9,'Ele se tornou uma coisa horrível': o depoimento de Amber Heard acusando o ex-marido Johnny Depp de agressão
9,Amber Heard afirma que Johnny Depp a agrediu por ciúmes de James Franco
9,"'Johnny Depp me agrediu em lua de mel', diz Amber Heard"
9,Chris Rock acusa Amber Heard de mentir em julgamento de Johnny Depp
9,Amber Heard é questionada sobre faca e recados de amor pelos advogados de Depp
10,"Veja as vagas de emprego disponíveis em Petrolina, Araripina e Salgueiro nesta quinta-feira (5)"
10,"Veja as vagas de emprego disponíveis em Petrolina, Araripina e Salgueiro nesta sexta-feira (6)"
10,"Veja as vagas de emprego disponíveis em Petrolina, Araripina e Salgueiro nesta segunda-feira (9)"
10,"Veja as vagas de emprego disponíveis em Petrolina, Araripina e Salgueiro nesta terça-feira (10)"
10,"Veja as vagas de emprego disponíveis em Petrolina, Araripina e Salgueiro nesta quarta-feira (11)"
11,INSS: direito aos novos pedidos de Aposentadoria por idade
11,Aposentadoria do INSS: Atuais regras para quem tem entre 40 e 60 anos de idade
11,Pedido da aposentadoria do INSS com 10 dicas especiais para todos
11,INSS: mais de 1 milhão esperam pela perícia médica
11,Calendário da Caixa do FGTS pelo Saque-aniversário
11,Aposentadoria: Sete dicas para encaminhar seu pedido ao INSS
11,Aposentadoria: Dicas especiais para encaminhar pedidos ao INSS
11,NIS deve ser usado na questão da aposentadoria pelo INSS?
11,Calendário da segunda parcela do 13º salário do INSS
11,Calendário do Saque extraordinário do FGTS com a Caixa
11,Mais de 1 milhão esperando perícia médica pelo INSS
11,INSS: Mais de 1 milhão esperando perícias
11,Parcela do 13º  em 2022 para quem ganha o salário mínimo
11,Motivos que levam o INSS a suspender benefícios dos segurados
11,Quem fica sem o Saque extraordinário do FGTS automático
11,Teto do INSS: Novo pagamento para os brasileiros
11,Saque extraordinário do FGTS: nascidos em maio podem sacar
11,Saque extraordinário do FGTS para nascidos em abril: Saiba como fazer a retirada
11,Aposentadoria: Erros na revisão podem reduzir valor no pagamento mensal do INSS
11,Saque extraordinário do FGTS: quem não fez o saque emergencial em 2020 pode não ter depósito automático
11,Calendário para pagamento de 13º salário do INSS
11,Aposentadoria do INSS: Saiba como ter a sua
11,Confira o novo valor do Teto do INSS pago nos benefícios
11,INSS: dúvidas sobre aposentadorias e regras  atuais de transição
11,Auxílio Brasil: pagamentos referentes a maio começam esta semana; veja quem recebe
11,Aposentadorias: Quem pode ter desconto de até 40%?
11,Novas exigências do INSS para pedidos
11,Auxílio-doença e aposentadoria por invalidez gera dúvidas para segurados do INSS
11,Auxílio-acidente do INSS pode liberar quanto?
11,Veja quem realmente tem direito do Auxílio Inclusão com o INSS
11,Calendário para retiradas de Saque Extraordinário do FGTS
11,Segurados com NIS finais 4 e 9 recebem primeira parcela do 13º
11,Dez dicas para evitar erros ao fazer os pedidos no INSS
11,Novas revisões de aposentadorias no INSS
11,Como devo efetuar contribuição para aposentadoria do INSS?
11,Entenda como tirar o Saque extraordinário do FGTS
11,Entenda o valor do MEI para pagar no INSS na contribuição
11,Saque extraordinário do FGTS: Como fazer a retirada?
11,Como posso dar entrada no benefício Auxílio-doença do INSS?
11,FGTS Extraordinário: nascidos em abril vão poder sacar a partir do dia 11
11,Autônomo pode ter aposentadoria liberada no INSS?
11,Regras novas para liberação de benefícios pelo INSS
11,Como somar a pontuação para aposentadoria do INSS?
11,Mulheres com câncer podem receber benefícios através do INSS: entenda
11,"3,8 milhões de trabalhadores poderão sacar até R$ 1 mil no FGTS amanhã"
11,15 dúvidas para pedir benefícios ao INSS
11,Como pagar INSS como autônomo? Veja como se inscrever e como emitir o carnê
11,Auxílio Brasil: parcela de maio começa a ser paga no dia 18; veja como fazer consulta ao benefício
11,13° salário do INSS: segunda parcela será paga a partir do dia 25
11,Quinze dúvidas para pedidos de benefício do INSS
11,Demora na concessão de BPC pelo INSS
11,FGTS: Nascidos em abril podem sacar até R$ 1 mil no saque extra
11,Saques do FGTS: Saiba o que é possível fazer para ter a liberação
11,Veja quem poderá sacar até R$ 1.000 a partir desta semana no Saque extraordinário do FGTS
11,"Benefícios em maio. Veja as datas de pagamento do INSS, Auxilio Brasil e FGTS"
11,Quem pode fazer a solicitação da Aposentadoria por idade do INSS?
11,Saque extraordinário do FGTS: nascidos em maio podem sacar até R$ 1.000 a partir deste sábado
11,Novo saque de até R$ 1.000 do FGTS começa amanhã; veja quem tem direito
11,Aposentadoria do INSS: Saiba quando vai conquistar
11,Aposentadoria do INSS pode ser menor
11,Aposentar antes da idade mínima no INSS: Entenda quando é possível
11,Veja como se inscrever para pagar INSS como autônomo
11,Novo Teto do INSS pode pagar até quanto todo mês?
11,Segurados com NIS finais 5 e 0 recebem 1º parcela do décimo terceiro
11,INSS: Pontuação para as novas aposentadorias
11,Como consultar para pedir o saque do FGTS?
11,Trabalhadores nascidos em abril podem sacar até R$ 1 mil do FGTS
11,Contas para aposentadoria especial pelo INSS
11,INSS: Saiba quando vai ter a sua aposentadoria concedida
11,IPTU 2022: pagamento começa na segunda-feira (16) no DF; confira calendário de vencimentos e como emitir o boleto
11,Auxílio-doença do INSS: Como dar entrada? Quem tem direito ao benefício?
11,Segunda parcela do 13º salário do INSS começa dia 25; veja o calendário
11,"3,8 milhões de trabalhadores poderão sacar o FGTS até R$ 1 mil neste sábado"
11,"3,6 milhões de trabalhadores nascidos em junho poderão sacar até R$ 1 mil no FGTS"
11,13º do INSS: veja quando começa o pagamento da segunda parcela
11,Posso solicitar os atrasados do INSS?
11,Trabalhador pode ter desconto de até 40% na aposentadoria do INSS; entenda
11,Veja como pedir o Auxílio-doença do INSS
11,Pontuação no INSS para as novas aposentadorias
11,Novo BPC: Como ser beneficiado pelo INSS?
11,INSS: qual preso pode receber o Auxílio Reclusão?
11,Beneficiários do Auxílio Brasil começam a receber o pagamento de maio
11,13º salário do INSS: quem não vai receber a 2ª parcela?
11,Saque extraordinário do FGTS: veja quem poderá sacar até R$ 1.000 a partir desta semana
11,Aposentado por invalidez que precisa de assistência tem direito a acréscimo de 25% no benefício; veja como pedir
11,Aposentadoria por idade do INSS: veja quem tem direito e como pedir o benefício
11,Quando solicitar a Pensão no INSS?
11,"3,6 milhões de trabalhadores nascidos em junho retiram o FGTS pela Caixa"
11,Calendário do Saque extraordinário do FGTS
11,Teto do INSS: Novo valor que está sendo pago
11,Beneficiários começam a receber o pagamento de maio do Auxílio Brasil
11,Declarar salário ou aposentadoria pelo INSS no IR é necessário?
11,Dúvidas sobre aposentadoria especial por insalubridade do INSS: Confira
11,13° Salário: Confira quando começa o pagamento da segunda parcela pelo INSS
11,Saque extra do FGTS será liberado para nascidos em abril e maio nesta semana
11,Novo pagamento do Auxílio-doença do INSS: Como dar entrada?
11,Calendário para Saque Extraordinário dos valores de FGTS
11,Tempo de demora de análise do benefício do INSS
11,Quem pode ter desconto de até 40% na aposentadoria do INSS
11,Saque extraordinário do FGTS: nascidos em abril podem sacar até R$ 1.000 a partir desta quarta
11,INSS é obrigado a pagar pelas perícias?
11,"FGTS: 3,8 milhões de trabalhadores poderão sacar até R$ 1 mil neste sábado"
11,Sistema online para o Saque Extraordinário do FGTS na Caixa
11,"3º lote para 3,5 milhões de trabalhadores com o FGTS"
11,Novo Saque do FGTS: Como pedir?
11,FGTS: profissionais nascidos em abril recebem até mil reais nesta quarta-feira
11,Como consultar o Saque do FGTS?
11,Revisão no INSS para valor da Aposentadoria: confira
11,INSS: segurados com NIS finais 5 e 0 recebem hoje primeira parcela do 13º
11,R$ 1 mil no FGTS para trabalhadores na Caixa
11,Valor de contribuição no INSS
11,Cronograma do Saque extraordinário do FGTS
11,Saiba quando vai aposentar no INSS
