cluster,titulo
89,"brMalls: ação fecha em queda de 0,12% nesta terça; veja valores"
89,"Magazine Luiza: ação fecha em alta de 1,28% nesta terça; veja valores"
89,"Vale: ação fecha em queda de 0,49% nesta sexta; veja valores"
89,Pão de Açúcar: ação tem maior baixa em mais de 6 meses nesta sexta; veja valores
89,"Itaú Unibanco: ação fecha em alta de 1,89% nesta sexta; veja valores"
89,"Magazine Luiza: ação fecha em queda de 3,85% nesta sexta; veja valores"
89,"Bradesco: ações fecham em alta de 1,97% nesta sexta; veja valores"
89,"Vale: ação fecha em queda de 4,07% nesta segunda; veja valores"
90,"Após ter celular furtado, morador de SP acumula R$ 143 mil de prejuízo em operações bancárias feitas por criminosos"
90,"Idosa tem prejuízo de R$ 26,1 mil após ter cartão de crédito furtado em Rio Preto"
90,Celular é furtado e ladrões movimentam R$ 143 mil mesmo após aviso a bancos
91,Twitter cai 11% após Elon Musk hesitar sobre compra; hora de vender ações?
91,'Só uma olhadinha': suspensão da compra do Twitter por Elon Musk gera memes
91,"Fundador da Binance não quer ser CEO do Twitter, mesmo se Elon Musk pedir"
91,Elon Musk diz querer suspender banimento de Trump no Twitter
91,URGENTE: Elon Musk afirma que continua “comprometido” com a compra do Twitter
91,Bilionário Elon Musk diz que compra do Twitter está suspensa temporariamente
91,"Após anúncio de Elon Musk, ações do Twitter caem quase 11%"
91,Ações do Twitter despencam após Musk suspender compra da rede social
91,"Saiba quanto tempo Anitta, Elon Musk e você levam para ganhar R$ 1 milhão"
91,Musk provoca dúvidas sobre compra de Twitter e ações da rede social despencam
91,Twitter perde mais três executivos em meio a impasse na negociação com Musk
91,Entenda por que as contas falsas do Twitter preocupam Elon Musk
91,Por que Elon Musk decidiu colocar compra do Twitter 'de molho'
91,Musk diz ainda estar comprometido com compra do Twitter após anunciar suspensão do acordo
91,Elon Musk anuncia suspensão temporária de acordo para comprar o Twitter
91,Entenda os planos de Elon Musk para o Twitter
91,Elon Musk anuncia suspensão temporária da compra do Twitter
91,Twitter vai ser pago? Entenda o polêmico plano de Elon Musk
91,Fundo de pensão processa Musk e Twitter para impedir compra da rede social
91,Ações do Twitter caem quase 11% na abertura da Bolsa de Nova York após Musk anunciar suspensão temporária de acordo de compra
91,Elon Musk suspende compra do Twitter e ações têm queda de 20% no pré-mercado
92,Pacheco assume Presidência da República nesta sexta
92,"Com viagem de Bolsonaro, Pacheco assume Presidência da República"
92,"Com Bolsonaro fora do país, Rodrigo Pacheco assume Presidência da República pela primeira vez"
93,PIS-PASEP: Como sacar abono salarial de 2019?
93,PIS/Pasep em 2022: veja como sacar valores do abono esquecido
93,Veja como sacar valores do abono salarial ‘esquecido’
93,PIS-PASEP: Entenda como retirar valores de abono salarial
93,PIS/Pasep: veja como sacar valores do abono salarial ‘esquecido’
93,PIS/Pasep: veja como sacar abono salarial 'esquecido'
93,PIS: Valores que vou sacar de Abono Salarial
93,PIS/Pasep: quem tabalhou em 2021 vai receber o abono salarial quando?
93,PIS/Pasep: Como fica o abono salarial para quem trabalhou em 2021?
94,Preço da gasolina sobe pela 4ª semana seguida e marca novo recorde
94,"Preço da gasolina chega a R$ 8,99 e sobe pela 4ª semana seguida, diz ANP"
94,Gasolina sobe pela quarta semana seguida e já tem posto cobrando quase R$ 9
95,Covid: Coreia do Sul diz que não poupará esforços para ajudar Coreia do Norte
95,Coreia do Norte dispara 3 mísseis balísticos após relatar surto de Covid
95,"Coreia do Norte lançou três mísseis balísticos, afirma exército sul-coreano"
95,"Coreia do Norte dispara provável míssil balístico a partir de submarino, dizem Coreia do Sul e Japão"
95,"Coreia do Norte lança provável míssil balístico de submarino, diz Coreia do Sul"
95,"Coreia do Norte lança provável míssil balístico, diz Japão"
95,"Coreia do Norte testa três misseis de curto alcance, diz exército sul-coreano"
96,Macron toma posse para segundo mandato como presidente da França
96,Presidente francês Macron toma posse para segundo mandato
96,Macron toma posse para segundo mandato e promete lutar por uma França 'mais independente'
97,Talibã ordena que mulheres afegãs usem véu que cubra o corpo e o rosto em público
97,Talibã ordena que mulheres voltem a cobrir rosto e corpo
97,Decreto do Talibã determina que afegãs usem véu para cobrir corpo e rosto
97,Talibã ordena que mulheres cubram corpo e rosto
97,Talibã ordena que afegãs usem burca de corpo inteiro em público
97,Taliban ordena que mulheres afegãs voltem a cobrir o rosto
98,Ônibus da dupla sertaneja Conrado e Aleksandro tomba e 6 pessoas morrem
98,Cantor Conrado está em estado grave após acidente que vitimou companheiro de dupla
98,"Cantor sertanejo Aleksandro, de dupla com Conrado, morre em acidente de ônibus"
98,Motorista filma ônibus de dupla sertaneja a mais de 130 km/h
98,"Após acidente com ônibus de dupla sertaneja, casa de shows substitui atração em São Pedro"
98,"Guitarrista Wisley Novaes, de Sandovalina, morre em acidente com ônibus da dupla Conrado e Aleksandro"
98,"Caso Conrado e Alexandro: Cantor é extubado quatro dias após acidente grave, mas segue internado em UTI"
98,Acidente com ônibus de dupla sertaneja mata cantor Aleksandro
98,"A Hora da Venenosa: Aleksandro, da dupla com Conrado, morre em acidente"
98,Novo vídeo mostra ônibus da dupla  Conrado e Aleksandro segundos antes do acidente; estrondo pode ser escutado
98,"Aleksandro, da dupla com Conrado, morre em acidente de ônibus na Régis Bittencourt, no interior de SP; mais 5 morreram"
98,Aleksandro postou vídeo dentro do ônibus horas antes do acidente
98,"Motorista grava ônibus de dupla sertaneja a mais de 130 km/h antes da fatalidade: 'depois acontece acidente', previu; VÍDEO"
98,"Aleksandro, da dupla com Conrado, morre em grave acidente de ônibus em SP"
98,Acidente com ônibus de dupla sertaneja deixa 5 mortos
98,"Conheça Aleksandro, cantor da dupla sertaneja que morreu em grave acidente de ônibus em rodovia do interior de SP; Fotos"
98,Dupla sertaneja e equipe sofrem grave acidente de ônibus em rodovia no interior de SP; cinco mortes já foram confirmadas
98,"Veja como ficou o ônibus após grave acidente que vitimou o cantor Aleksandro, da dupla com Conrado, e matou outros cinco passageiros"
98,"Aleksandro, da dupla com Conrado, morre em acidente de ônibus"
98,"Quem é a dupla sertaneja Conrado e Aleksandro, vítima de acidente de ônibus em São Paulo"
98,"Após acidente, cantor sertanejo Conrado passa por cirurgia"
98,"Quem são Conrado e Aleksandro, que formam a dupla sertaneja de MS que sofreu acidente grave de ônibus em SP"
99,"Kiev:Todas as mulheres, crianças e idosos deixaram Azovstal"
99,Ucrânia diz que todas as mulheres e crianças foram retiradas de siderúrgica de Mariupol
99,"'Todas as mulheres, crianças e idosos saíram de Azovstal', diz vice-primeira-ministra da Ucrânia"
100,Cliente do BH Shopping filma correria após assalto a relojoaria
100,Homens assaltam relojoaria dentro de shopping em BH e causam pânico; VÍDEOS
100,Tentativa de assalto a relojoaria de luxo causa pânico dentro do BH Shopping
101,"Vacina contra gripe: Jacareí começa a vacinar professores, PCDs e indígenas na próxima segunda-feira (9)"
101,"Veja como se vacinar contra a Covid, gripe ou sarampo na próxima semana em Sorocaba"
101,"Covid-19, gripe e sarampo: saiba onde Macapá oferta vacinas em 17 de maio"
102,"Mesmo após determinação da justiça, linhas de ônibus param de funcionar, em Campina Grande"
102,"Mesmo após intimação judicial, linhas de ônibus permanecem suspensas em distritos de Campina Grande"
102,Sitrans diz que vai suspender quatro linhas de ônibus em Campina Grande a partir deste sábado (7)
103,Idoso sem CNH pode ter o cartão para  estacionamentos
103,Como faço para obter pela internet o Cartão do Idoso para estacionamentos?
103,Como faço para obter o Cartão do Idoso para estacionamentos?
104,EPTV 2 Ribeirão e Franca ao vivo
104,EPTV 2 Campinas ao vivo
104,EPTV 2 Piracicaba ao vivo
105,Enem: saiu resultado dos recursos para isenção da taxa de inscrição
105,Inep altera normas para utilização dos resultados do Enem
105,Inep publica resultado dos recursos para isenção de taxa de inscrição no Enem
106,"Oportunidade: MG tem 51 concursos abertos, com 4 mil vagas e salários de até R$ 18 mil"
106,Embraer abre mil vagas de trabalho no Brasil
106,"Hortolândia abre 446 vagas para concursos públicos e cargos temporários; salários chegam a R$ 16,2 mil"
106,"Concursos públicos oferecem 27,1 mil vagas com salários de até R$ 30,4 mil"
106,Fábrica da Embraer em Gavião Peixoto abre 8 vagas de emprego; saiba como se candidatar
106,Itajubá tem vagas temporárias com salários entre R$ 1 mil e R$ 13 mil; veja como se inscrever
106,Embraer abre mil vagas de emprego; saiba como se candidatar
106,Embraer abre mil vagas de emprego para diferentes áreas; veja como se inscrever
107,"Ataque russo a escola deixa ao menos dois mortos na Ucrânia, diz governador de Luhansk"
107,Bombardeio a escola no leste da Ucrânia termina com 60 mortos
107,"Bombardeio russo deixa mortos no leste da Ucrânia, diz governador"
107,"Ataque ucraniano na Rússia deixa um morto e três feridos, diz governador russo"
107,"Ataque russo a escola na Ucrânia causou 60 mortes, diz Zelensky"
107,Ataque russo em Bakhmut deixa 3 mortos
108,Forma segura de entrar nos programas do Cadastro Único
108,Maneira segura de entrar no Cadastro Único e ter acesso aos benefícios
108,Cadastro Único com a forma correta de entrar no benefício
109,PAT de Araraquara tem 16 vagas de emprego para diversos níveis; saiba como se candidatar
109,Região de Piracicaba começa semana com 1.069 vagas de emprego; saiba como se candidatar
109,"Veja como se candidatar às vagas de emprego disponíveis na região de Ribeirão Preto, SP"
110,Rússia justifica guerra na Ucrânia durante celebração da vitória de 1945 contra os nazistas
110,"Em discurso, Putin culpa Otan e Ucrânia por guerra"
110,"Guerra na Ucrânia: por que o Dia da Vitória, em 9 de maio, é tão importante para a Rússia"
110,"No Dia da Vitória, Putin culpa Ocidente pela guerra na Ucrânia"
110,Rússia nega intenção de declarar formalmente guerra contra Ucrânia em 9 de maio
110,Dia da Vitória: Putin compara invasão da Ucrânia à vitória na 2ª Guerra Mundial
111,"VÍDEOS: BDP de sexta-feira, 13 de maio"
111,"VÍDEOS: BDP desta segunda-feira, 09 de maio de 2022"
111,"VÍDEOS: BDP de terça-feira, 10 de maio"
112,Primeiro-ministro do Sri Lanka renuncia após confrontos violentos
112,Premiê do Sri Lanka renuncia após protestos ligados à crise econômica
112,Primeiro-ministro do Sri Lanka renuncia após confrontos que deixaram mortos e feridos
113,"Alta de 8,9% do diesel da Petrobras para distribuidoras entra em vigor"
113,"Petrobras anuncia reajuste de 8,8% do diesel nas refinarias"
113,"Petrobras anuncia aumento de 8,8% no preço do diesel para distribuidoras"
113,Diesel da Petrobras fica mais caro a partir de terça-feira
113,Petrobras aumenta em 9% preço do diesel nas refinarias a partir de amanhã
113,"Petrobras aumenta em 8,87% preço do diesel"
113,Petrobras reajusta preço do diesel em quase 9%
113,"Petrobras aumenta em 8,87% o preço cobrado pelo diesel"
114,Devolução do Pix pode ser solicitado em bancos
114,Pix errado pode ser devolvido nos bancos?
114,Devolução do Pix feito errado pode ser solicitada?
115,"Sem acordo, PSD de Minas pode apoiar Bolsonaro, e não Lula"
115,PT e PSD se aproximam de acordo para palanque com Lula e Kalil em Minas
115,"Inviabilizar um acordo entre PT e PSD em Minas atrapalharia Lula, mas também Kalil, diz Gleisi"
116,Diamante branco raro vai a leilão com expectativa de recorde
116,Diamante branco gigante vai a leilão com expectativa de valor recorde
116,The Rock: Diamante branco raro vai a leilão com expectativa de recorde
117,Príncipe Charles substituirá rainha Elizabeth 2ª em tradicional discurso no Parlamento
117,Príncipe Charles substitui rainha Elizabeth pela 1ª vez na abertura do Parlamento britânico
117,"Em momento histórico, príncipe Charles substitui Elizabeth 2ª pela primeira vez em 'discurso do trono'"
118,Centro-oeste paulista terá semana de frio intenso e temperaturas podem cair para menos de 5°C; veja previsão
118,Massa polar e 4ºC: confira dia a dia o impacto da frente fria e a queda das temperaturas em Campinas
118,Temperatura 'despenca' na próxima semana e mínima pode chegar a 3ºC em Campo Grande
118,Calor e tempo seco marcam a semana no Centro-Oeste de Minas; veja previsão
118,Sul de Minas deve ter temperaturas negativas e geada a partir desta quarta-feira; veja previsão do tempo
118,RS deve ter frio intenso e vento de até 100 km/h nos próximos dias; há chance de neve na Serra
118,Temperaturas devem cair no ES durante a semana e há risco de geada na Região Serrana
118,Massa de ar polar atinge o RS na próxima semana e pode criar condições para neve em maio
118,Onda de frio: o que esperar da massa polar que vai gelar grande parte do Brasil
118,Queda de temperatura deixa tempo ameno no Acre com a chegada de mais uma frente fria
118,Se prepare: frio e chuva marcam o fim de semana nas cidades do Centro-Oeste de Minas; veja previsão
118,Massa de ar polar faz temperatura cair em São Paulo e frio pode bater recorde
118,"Massa de ar polar deve derrubar temperaturas em Pernambuco até o fim de semana, diz Apac"
118,"Chuva, frio e até geada: entenda a massa de ar polar que vai derrubar temperatura no ES esta semana"
118,Mudança no tempo: frente fria promete derrubar temperaturas pelo Brasil
119,FGTS: Acima de 60 anos trabalhador poderá sacar valores na CEF
119,FGTS poderá ser sacado por trabalhadores acima dos 60 anos?
119,Trabalhador acima dos 60 anos poderá sacar os valores do FGTS?
119,FGTS: acima de 60 anos trabalhador poderá sacar valores do benefício
120,Concurso público para professor com 2 mil vagas em Fortaleza é sancionado
120,Prefeitura de Elias Fausto abre concurso público com 13 vagas para área da saúde
120,"Campinas abre 27 vagas em concurso público para a Saúde com salários até R$ 8,2 mil; veja edital"
121,Bombeiro suspeito de atirar em atendente se apresenta à delegacia
121,Bombeiro suspeito de atirar contra atendente de fast-food se apresenta à Polícia
121,Bombeiro identificado como atirador de atendente em Mc Donald´s se apresenta em delegacia
122,Covid-19: taxa de transmissão sobe no DF; veja números
122,Covid-19: taxa de transmissão sobe; DF registra 309 novos casos e mais 2 mortes
122,"Covid-19: em 20 dias, taxa de transmissão aumenta 65% no DF"
123,Governo estuda zerar imposto de importação do aço e de mais dez produtos
123,"Inflação, imposto do aço e mais: veja o que pode afetar seus investimentos"
123,Representantes do setor do aço pedem a Guedes que governo não reduza imposto de importação
124,Teve o celular roubado? Veja como proteger acesso a apps de bancos
124,Proteção de dados pessoais em caso de celular roubado
124,Meio de proteção de dados em caso de roubo ou furto de celulares
124,Em caso de furto ou roubo de celular consigo realizar a proteção de dados pessoais?
124,Veja como proteger acesso a apps de bancos
124,Como proteger aplicativos de bancos em caso de roubo de celular
125,"Após menor marca da história em 2021, governo prevê reduzir ainda mais gasto com pessoal"
125,Governo teme desgaste e avalia ampliar subsídio ao diesel antes da eleição
125,Bolsonaro troca ministro de Minas e Energia para tentar se livrar de desgaste político com alta do diesel
125,Salário mínimo: perda no poder de compra pela primeira vez desde o Plano Real
125,Aliados de Bolsonaro avaliam que governo precisa evitar nova alta do diesel
125,Oyama: Bolsonaro quer evitar nova alta do diesel na marra com novo subsídio
126,"Produção industrial cresce em 9 dos 15 locais pesquisados em março, aponta IBGE"
126,"Serviços crescem 1,7% no mês de fevereiro para março, diz IBGE"
126,"Inflação de serviços sobe 0,66% em abril ante 0,45% em março no IPCA"
126,"Serviços crescem 1,7% de fevereiro para março, diz IBGE"
126,"Volume de serviços prestados sobe 1,7% em março ante fevereiro, revela IBGE"
126,Indústria cresce em nove dos 15 locais analisados pelo IBGE
126,"Vendas do varejo crescem 1% de fevereiro para março, diz IBGE"
126,IBGE: Produção industrial sobe em 9 de 15 locais em março ante fevereiro
126,"Volume de vendas do varejo cresce pelo terceiro mês seguido na PB, diz IBGE"
126,IBGE: Vendas do varejo subiram 4% em março de 2022 ante o mesmo mês de 2021
127,O que você deve saber hoje antes de fazer seus investimentos? Veja ao vivo
127,Ao vivo: Veja o que pode influenciar nos seus investimentos hoje
127,Não ter informações confiáveis sobre investimentos pode pôr tudo a perder
127,Privatização da Petrobras: o que é preciso fazer? Ainda dá tempo em 2022?
128,ONU eleva para 3.309 número de civis mortos em invasão da Ucrânia pela Rússia
128,ONU diz que há 'milhares de mortes' a mais que a contagem oficial na Ucrânia
128,ONU: Ucrânia tem milhares de mortos a mais que número oficial
129,Novas regras para concessão do Auxílio Brasil e os critérios atuais
129,Quais serão os critérios para a escolha das novas famílias no Auxílio Brasil?
129,Auxílio-alimentação e as novas regras na concessão
130,Ibaneis revoga decreto de calamidade pública por Covid-19
130,"No DF, governador revoga decreto de estado de calamidade pública"
130,Ibaneis Rocha revoga estado de calamidade pública no Distrito Federal
131,"Vladimir Putin quer ampliar guerra para a Moldávia, diz representante de departamento inteligência dos EUA"
131,"Putin se prepara para guerra prolongada na Ucrânia, diz chefe de espionagem dos EUA"
131,"Fim da guerra não será imediato, diz ONU; EUA afirmam que Putin se prepara para incursão longa"
132,Soldados ucranianos deixam siderúrgica em Mariupol
132,"Mais de mil militares ucranianos permanecem no complexo de Azovstal, em Mariupol"
132,Saiba como ucranianos estão se abrigando dos ataques russos em antigas siderúrgicas
133,Multas e Juros: Pequenas e micros empresas podem quitar dívidas com até 90% de descontos
133,Desconto sobre multas e juros para micro e pequenas empresas: Fique por dentro
133,Micro e pequenas empresas com 90% de desconto sobre multas e juros
134,"""Quando eu berrava, ele me apagava"", conta mulher torturada por namorado na zona sul do Rio"
134,"Acusado de torturar e queimar a namorada com faca quente é preso na vila de Boa Vista do Cuçari, em Prainha"
134,Norte de MG: mulher é presa suspeita de atear fogo em morador em situação de rua
135,Carnaval em Nova Friburgo: veja apuração dos votos e como foi a cobertura em Tempo Real do desfile das Escolas de Samba na cidade
135,Carnaval 2023 em Juiz de Fora terá desfiles das escolas de samba na Avenida Brasil; confira a programação
135,Beco da Cultura é inaugurado em Juiz de Fora com atração do samba; confira
136,"Finlândia pede para entrar na Otan, e Rússia ameaça com retaliação"
136,China diz que adesão da Finlândia à Otan adiciona ‘novo fator’
136,"Depois de decisão da Finlândia, Suécia solicitará oficialmente adesão a Otan"
136,Turquia é contra adesão da Suécia e da Finlândia à Otan
136,Suécia pretende entregar hoje pedido de entrada na Otan
136,Entenda por que Finlândia e Suécia mantinham neutralidade e agora querem entrar na Otan
136,Putin diz que Rússia responderá se Otan reforçar Suécia e Finlândia militarmente
136,Rússia faz ameaça de retaliação após Finlândia anunciar pedido de adesão à Otan
136,Parlamento da Finlândia aprova adesão à Otan
136,Finlândia deseja adesão 'sem demora' à Otan e Rússia se diz ameaçada
136,Suécia e Finlândia entregam na quarta-feira a candidatura à Otan
136,Parlamento da Finlândia aprova candidatura a membro da Otan
136,Kremlin diz que adesão da Finlândia à Otan é 'definitivamente uma ameaça à Rússia'
136,Erdogan diz que Turquia não apoia adesão de Finlândia e Suécia à Otan
136,Finlândia anuncia adesão à Otan ‘sem demora’
136,Países nórdicos apoiam adesão da Finlândia e da Suécia à Otan
136,Reino Unido: Finlândia e Suécia devem aderir à Otan 'o mais rápido possível'
136,"Parlamento da Finlândia aprova entrada na Otan, e Suécia assina carta de adesão"
136,"Membro da Otan, Turquia se opõe à entrada de Suécia e Finlândia na aliança militar"
136,Rússia sobe tom contra entrada de Finlândia e Suécia na Otan
136,"Ucrânia espera nova ofensiva da Rússia, que volta a criticar Suécia e Finlândia por adesão à Otan"
136,Por que Turquia diz que vetará entrada de Suécia e Finlândia na Otan
136,Turquia negociará entrada da Finlândia e Suécia na Otan no sábado em Berlim
136,Turquia diz que vai bloquear entrada de Suécia e Finlândia na Otan
136,"Com entrada na Otan, Suécia e Finlândia podem se tornar alvo, diz representante da Rússia na ONU"
136,Suécia e Finlândia ficarão mais seguras se aderirem à Otan?
136,EUA apoiam ‘fortemente’ adesão da Finlândia e da Suécia à Otan
136,Turquia diz que não aprovará entrada de Suécia e Finlândia na Otan
136,Otan espera que Turquia não barre adesão de Finlândia e Suécia à aliança
136,Turquia diz que não aprovará ingresso de Suécia e Finlândia na Otan
136,"Após avanço da Finlândia para entrada na Otan, Suécia indica que pedirá ingresso na aliança militar"
136,Finlândia e Suécia estão cada vez mais perto da OTAN
136,"Finlândia, país vizinho da Rússia, anuncia que quer se juntar à Otan"
136,"Após Finlândia, Suécia indica que pedirá ingresso na Otan"
136,Turquia dirá não à entrada de Finlândia e Suécia na Otan
136,Partido no poder na Suécia aprova candidatura à Otan
136,EUA apoiam que Finlândia e Suécia solicitem adesão à Otan
136,Finlândia pede paciência após Turquia não apoiar entrada na Otan
136,"Depois da Finlândia, Suécia indica que vai aderir à Otan"
137,Namorada do cantor Conrado pede orações pela saúde do sertanejo internado em UTI: 'Creio que Deus é a cura'
137,"Cantor Conrado tem melhora no quadro de saúde, mas continua internado na UTI"
137,"Cantor Conrado apresenta melhora  clínica, mas segue internado na UTI"
138,Governo aciona STF contra políticas estaduais de ICMS sobre diesel
138,STF derruba decisão do Confaz sobre o ICMS do diesel
138,Governo pede ao Supremo suspensão de políticas estaduais sobre o ICMS que incide no diesel
138,Governo recorre ao STF contra alíquotas diferentes do ICMS sobre o diesel nos estados
138,Pacheco diz que vai pedir a estados manutenção do congelamento do ICMS sobre combustíveis
138,"Decisão de Mendonça sobre ICMS vai aumentar tributação sobre combustíveis, diz Wellington Dias"
138,Estados vão recorrer de decisão do STF que altera a cobrança sobre o imposto do diesel
138,Governador do DF questiona no STF mudanças no ICMS de mercadorias
138,Governo entra com ação no STF para obrigar estados a cobrarem alíquota única do ICMS sobre o diesel
138,Bolsonaro vai ao STF contra política de ICMS dos estados sobre diesel
138,Governo vai ao STF para suspender resolução do Confaz sobre diesel
139,Motorista suspeito de atropelar ciclista no Bairro Shopping Park em Uberlândia é identificado
139,"Motorista suspeito de atropelar ciclista no Bairro Shopping Park, em Uberlândia, diz ter se distraído com celular; reveja vídeo"
139,Motorista atropela ciclista e bate em poste no Bairro Shopping Park em Uberlândia
140,Senado aprova aumento de gastos com publicidade de governos
140,Senado aprova MP que prorroga incentivo fiscal à exportação
140,'Orçamento secreto': valor de emendas que Senado informou ao STF supera verba de 6 ministérios
140,Senado aprova projeto que aumenta limite de gastos com propaganda em ano eleitoral
141,"Justiça de SP torna donas de escola e auxiliar rés por tortura, maus-tratos e outros crimes contra crianças amarradas em vídeos"
141,Justiça de SP aceita denúncia contra donas e funcionária de escola
141,Donas de escola e funcionária se tornam rés por tortura e maus-tratos contra crianças em SP
142,Sachsida entrega pedido de início de desestatizações da PPSA e Petrobras a Guedes
142,Bento Albuquerque diz que saída do Ministério de Minas e Energia foi decisão 'de caráter pessoal'
142,"Novo ministro de Minas e Energia, Adolfo Sachsida, faz primeiro pronunciamento em Brasília"
142,"Quem é Adolfo Sachsida, recém-nomeado ministro de Minas e Energia"
142,Bento Albuquerque deixa Minas e Energia e Sachsida é o novo ministro
142,Ministro de Minas e Energia diz que pedirá estudos sobre privatizar estatal do pré-sal e Petrobras
142,Bento Albuquerque deixa Ministério de Minas e Energia; Sachsida é nomeado
142,Novo ministro de Minas e Energia entrega a Guedes pedido de estudo sobre privatização da Petrobras
143,Por que OMS classificou política da China para covid de 'insustentável'
143,OMS critica política de combate à covid na China
143,China censura críticas da OMS sobre política de 'Covid zero'
144,"PSDB, MDB e Cidadania vão usar pesquisas para definir candidatura única à Presidência"
144,"MDB, PSDB e Cidadania prometem escolher nome com base em pesquisas"
144,"PSDB, MDB e Cidadania afirmam que pesquisas vão definir candidato único"
145,Opinião: Bolsonaro não vai privatizar Petrobras nem mexer nos preços
145,Bolsonaro poderia reduzir preços de combustíveis sem mudar política da Petrobras
145,Bolsonaro fala em 'papel social' da Petrobras e busca 'vias legais' para interferir na estatal
